area,bathrooms,bedrooms,description,fetched_at,furnished,images,listing_id,location,price,property_type,seller_name,title,url
980 Sqft,1,0,"This property is a 980 Sqft studio condo with 1 bathroom that is available for rent. It is part of the Tijani Raja Dewa - Apartments project in Panji, Kelantan and was completed in Mar 2023. You can rent this condo long term for RM300 per month.
Studio Bedroom With Private Bathroom For Rent
(The whole unit for rent) Studio bedroom and private bathroom For rent
Please kindly text Mr Moh on WhatsApp +601127433606 If interested.
➤Studio for single or couple ➤Studio + 1 Car Park
➤ Female Can Rent✅
➤Male Can Rent✅
No sharing with other tenants
Available for both Short term and Long term tenants.
𝐑𝐌 300 per month
Book the unit now
House furnished 🏠 ➤ kitchen cabinets ➤ washing machine ➤ Induction cooker ➤ water purifier ➤ Microwave
If interested, Please kindly text Mr Moh on WhatsApp +601127433606 for more details htts:/wa.me/601127433606",2025-12-13T23:49:23.120566+00:00,Fully Furnished,"https://cdn.fazwaz.com/wbr/HaERsVwtR3NuPfE2tOHDQ6w3hdg/2850x1515/unit/5860725/img-0898.jpeg,https://cdn.fazwaz.com/wbr/iVXXGy77hlTwBq0v5CwOuK64CIE/250x250/unit/5860725/img-0899.jpeg,https://cdn.fazwaz.com/wbr/qa-pRIJCWHfg_xitBqN6SDXRHWk/250x250/unit/5860725/img-0900.jpeg,https://cdn.fazwaz.com/wbr/qh3LtCfFKIQezxJhHgy1KFv5Qu8/250x250/unit/5860725/img-0901.jpeg,https://cdn.fazwaz.com/wbr/wbbcVUPfieV0U-s9NuJ2531oQF0/250x250/unit/5860725/img-0898_1.jpeg",U5860725,"Panji, Kota Bharu, Kelantan",RM300,Condo,Private Owner,Studio Condo for rent at Tijani Raja Dewa - Apartments,https://www.fazwaz.my/property-rent/studio-condo-for-rent-at-tijani-raja-dewa-apartments-in-panji-kelantan-u5860725
"1,120 Sqft",1,0,"This property is a 1,120 Sqft studio penthouse with 1 bathroom that is available for rent. It is part of the Tijani Raja Dewa - Apartments project in Panji, Kelantan and was completed in Mar 2023. You can rent this penthouse long term for RM550 per month.
Sky River Front Service Apartment 1 Bed 1 Bath Studio/Condo
Kindly wa.me for appointment Viewing and also for more details on how to rent tq +60 10-438 1029",2025-12-13T23:49:23.120566+00:00,Fully Furnished,"https://cdn.fazwaz.com/wbr/ZgJH-xNSsSKK5RTiTgysvkLz7JM/2850x1515/unit/5622399/img-6139.jpeg,https://cdn.fazwaz.com/wbr/M2OXWYOoqdsQwVB-7zti4jhXs3k/250x250/unit/5622399/img-6140.jpeg,https://cdn.fazwaz.com/wbr/5Xj3LKrM50ZCQ9YmgVG80qTs8Eg/250x250/unit/5622399/img-6142.jpeg,https://cdn.fazwaz.com/wbr/iMz1o9QyAYCGiekCF0-bEhOYogE/250x250/unit/5622399/img-6145.jpeg,https://cdn.fazwaz.com/wbr/AhFYtuOZQLca20Mt64mH_mwokkg/250x250/unit/5622399/img-6146.jpeg",U5622399,"Panji, Kota Bharu, Kelantan",RM550,Penthouse,Private Owner,Studio Penthouse for rent at Tijani Raja Dewa - Apartments,https://www.fazwaz.my/property-rent/studio-penthouse-for-rent-at-tijani-raja-dewa-apartments-in-panji-kelantan-u5622399
